"title","industry","genre","year","director","cast","rating","description","poster_url"
"Dostana","Bollywood","Comedy Drama Romance","2008","Tarun Mansukhani","Abhishek Bachchan, John Abraham, Priyanka Chopra, Kiron Kher","7.1","A Bollywood Comedy Drama Romance film released in 2008, directed by Tarun Mansukhani and starring Abhishek Bachchan, John Abraham, Priyanka Chopra, Kiron Kher.",""
"Kurbaan","Bollywood","Action Crime Drama","2009","Renzil D'Silva","Kareena Kapoor, Saif Ali Khan, Om Puri, Vivek Oberoi","5.3","A Bollywood Action Crime Drama film released in 2009, directed by Renzil D'Silva and starring Kareena Kapoor, Saif Ali Khan, Om Puri, Vivek Oberoi.",""
"3 Idiots","Bollywood","Comedy Drama","2009","Rajkumar Hirani","Aamir Khan, Kareena Kapoor, Madhavan, Sharman Joshi","11.6","A Bollywood Comedy Drama film released in 2009, directed by Rajkumar Hirani and starring Aamir Khan, Kareena Kapoor, Madhavan, Sharman Joshi.",""
"Jai Ho","Bollywood","Action Drama","2014","Sohail Khan","Salman Khan, Tabu, Sunil Shetty, Genelia D'Souza","8","A Bollywood Action Drama film released in 2014, directed by Sohail Khan and starring Salman Khan, Tabu, Sunil Shetty, Genelia D'Souza.",""
"My Name Is Khan","Bollywood","Drama Romance Thriller","2010","Karan Johar","Shah Rukh Khan, Kajol, Katie A. Keane, Kenton Duty","8.9","A Bollywood Drama Romance Thriller film released in 2010, directed by Karan Johar and starring Shah Rukh Khan, Kajol, Katie A. Keane, Kenton Duty.",""
"Toonpur Ka Superrhero","Bollywood","Animation Action Adventure","2010","Kireet Khurana","Ajay Devgn, Sanjay Dutt, Delnaaz Irani, Chinky Jaiswal","4.4","A Bollywood Animation Action Adventure film released in 2010, directed by Kireet Khurana and starring Ajay Devgn, Sanjay Dutt, Delnaaz Irani, Chinky Jaiswal.",""
"Hello Darling","Bollywood","Comedy Drama","2010","Manoj Tiwari","Gul Panag, Celina Jaitly, Isha Koppikar, Chunky Pandey","4.4","A Bollywood Comedy Drama film released in 2010, directed by Manoj Tiwari and starring Gul Panag, Celina Jaitly, Isha Koppikar, Chunky Pandey.",""
"Thoda Pyaar Thoda Magic","Bollywood","Comedy Drama Family","2008","Kunal Kohli","Rishi Kapoor, Saif Ali Khan, Rani Mukerji, Akshat Chopra","5.3","A Bollywood Comedy Drama Family film released in 2008, directed by Kunal Kohli and starring Rishi Kapoor, Saif Ali Khan, Rani Mukerji, Akshat Chopra.",""
"Jaane Kahan Se Aayi Hai","Bollywood","Comedy Drama Fantasy","2010","Milap Zaveri","Priyanka Chopra, Akshay Kumar, Jacqueline Fernandez, Karan Johar","4.4","A Bollywood Comedy Drama Fantasy film released in 2010, directed by Milap Zaveri and starring Priyanka Chopra, Akshay Kumar, Jacqueline Fernandez, Karan Johar.",""
"Get Educated: Paathshaala","Bollywood","Drama","2010","Milind Ukey","Nana Patekar, Shahid Kapoor, Ayesha Takia, Sushant Singh","5.3","A Bollywood Drama film released in 2010, directed by Milind Ukey and starring Nana Patekar, Shahid Kapoor, Ayesha Takia, Sushant Singh.",""
"Ek Vivaah... Aisa Bhi","Bollywood","Drama Romance","2008","Kaushik Ghatak","Isha Koppikar, Sonu Sood, Anand Abhyankar, Daman Baggan","5.3","A Bollywood Drama Romance film released in 2008, directed by Kaushik Ghatak and starring Isha Koppikar, Sonu Sood, Anand Abhyankar, Daman Baggan.",""
"Kites","Bollywood","Action Drama Romance","2010","Anurag Basu","Hrithik Roshan, B?rbara Mori, Steven Michael Quezada, Kangana Ranaut","5.3","A Bollywood Action Drama Romance film released in 2010, directed by Anurag Basu and starring Hrithik Roshan, B?rbara Mori, Steven Michael Quezada, Kangana Ranaut.",""
"Bad Luck Govind","Bollywood","Comedy Crime Drama","2009","Varun Khanna","Gaurav Kapoor, Hrishitaa Bhatt, Govind Namdeo, Zakir Hussain","4.4","A Bollywood Comedy Crime Drama film released in 2009, directed by Varun Khanna and starring Gaurav Kapoor, Hrishitaa Bhatt, Govind Namdeo, Zakir Hussain.",""
"Tulsi: Mathrudevobhava","Bollywood","Drama","2008","Ajay Kumar","Manisha Koirala, Irrfan Khan, Sadashiv Amrapurkar, Tinnu Anand","4.4","A Bollywood Drama film released in 2008, directed by Ajay Kumar and starring Manisha Koirala, Irrfan Khan, Sadashiv Amrapurkar, Tinnu Anand.",""
"Acid Factory","Bollywood","Action Crime Drama","2009","Suparn Verma","Fardeen Khan, Dia Mirza, Manoj Bajpayee, Aftab Shivdasani","4.4","A Bollywood Action Crime Drama film released in 2009, directed by Suparn Verma and starring Fardeen Khan, Dia Mirza, Manoj Bajpayee, Aftab Shivdasani.",""
"Ab... Bas!","Bollywood","Thriller","2004","Rajesh Kumar Singh","Chetanya Adeep, Shawar Ali, Arun Bakshi, Chitrapama","4.4","A Bollywood Thriller film released in 2004, directed by Rajesh Kumar Singh and starring Chetanya Adeep, Shawar Ali, Arun Bakshi, Chitrapama.",""
"Barah Aana","Bollywood","Comedy Crime Drama","2009","Raja Menon","Naseeruddin Shah, Vijay Raaz, Arjun Mathur, Violante Placido","4.4","A Bollywood Comedy Crime Drama film released in 2009, directed by Raja Menon and starring Naseeruddin Shah, Vijay Raaz, Arjun Mathur, Violante Placido.",""
"Dil Bole Hadippa!","Bollywood","Comedy Drama Sport","2009","Anurag Singh","Shahid Kapoor, Rani Mukerji, Anupam Kher, Dalip Tahil","5.3","A Bollywood Comedy Drama Sport film released in 2009, directed by Anurag Singh and starring Shahid Kapoor, Rani Mukerji, Anupam Kher, Dalip Tahil.",""
"Bhram: An Illusion","Bollywood","Drama Mystery Romance","2008","Pavan Kaul","Dino Morea, Milind Soman, Sheetal Menon, Simone Singh","4.4","A Bollywood Drama Mystery Romance film released in 2008, directed by Pavan Kaul and starring Dino Morea, Milind Soman, Sheetal Menon, Simone Singh.",""
"26th July at Barista","Bollywood","Drama","2008","Mohan Sharma","Ajita, Himani Chawla, Sumeet Chawla, Suresh Dubey","4.4","A Bollywood Drama film released in 2008, directed by Mohan Sharma and starring Ajita, Himani Chawla, Sumeet Chawla, Suresh Dubey.",""
"Jannat: In Search of Heaven...","Bollywood","Crime Drama Romance","2008","Kunal Deshmukh","Emraan Hashmi, Sonal Chauhan, Shakeel Khan, Sameer Kochhar","9.8","A Bollywood Crime Drama Romance film released in 2008, directed by Kunal Deshmukh and starring Emraan Hashmi, Sonal Chauhan, Shakeel Khan, Sameer Kochhar.",""
"Yaar Meri Zindagi","Bollywood","Drama Family Musical","2008","Ashok Gupta, Mukul Dutt","Amitabh Bachchan, Shatrughan Sinha, Sharda, Sudha Chandran","4.4","A Bollywood Drama Family Musical film released in 2008, directed by Ashok Gupta, Mukul Dutt and starring Amitabh Bachchan, Shatrughan Sinha, Sharda, Sudha Chandran.",""
"The President Is Coming","Bollywood","Comedy","2009","Kunaal Roy Kapur","Konkona Sen Sharma, Shernaz Patel, Shivani Tanksale, Anand Tiwari","4.4","A Bollywood Comedy film released in 2009, directed by Kunaal Roy Kapur and starring Konkona Sen Sharma, Shernaz Patel, Shivani Tanksale, Anand Tiwari.",""
"Dil Kabaddi","Bollywood","Comedy Drama","2008","Anil Senior","Irrfan Khan, Rahul Bose, Rahul Khanna, Konkona Sen Sharma","5.3","A Bollywood Comedy Drama film released in 2008, directed by Anil Senior and starring Irrfan Khan, Rahul Bose, Rahul Khanna, Konkona Sen Sharma.",""
"Via Darjeeling","Bollywood","Drama Mystery Thriller","2008","Arindam Nandy","Kay Kay Menon, Sonali Kulkarni, Parvin Dabas, Vinay Pathak","4.4","A Bollywood Drama Mystery Thriller film released in 2008, directed by Arindam Nandy and starring Kay Kay Menon, Sonali Kulkarni, Parvin Dabas, Vinay Pathak.",""
"EMI: Liya Hai To Chukana Padega","Bollywood","Comedy Crime Drama","2008","Saurabh Kabra","Malaika Arora, Arun Bakshi, Aashish Chaudhary, Snehal Dabi","4.4","A Bollywood Comedy Crime Drama film released in 2008, directed by Saurabh Kabra and starring Malaika Arora, Arun Bakshi, Aashish Chaudhary, Snehal Dabi.",""
"Welcome to Sajjanpur","Bollywood","Comedy Drama","2008","Shyam Benegal","Shreyas Talpade, Amrita Rao, Ravi Kishan, Ila Arun","7.1","A Bollywood Comedy Drama film released in 2008, directed by Shyam Benegal and starring Shreyas Talpade, Amrita Rao, Ravi Kishan, Ila Arun.",""
"Mumbai Cutting","Bollywood","Drama","2011","Jahnu Barua, Rahul Dholakia, Rituparno Ghosh, Shashanka Ghosh, Manish Jha, Anurag Kashyap, Sudhir Mishra, Ruchi Narain, Ayush Raina, Revathy, Kundan Shah","Raj Singh Arora, Abhisar Bose, Neetu Chandra, Master Chinmay","4.4","A Bollywood Drama film released in 2011, directed by Jahnu Barua, Rahul Dholakia, Rituparno Ghosh, Shashanka Ghosh, Manish Jha, Anurag Kashyap, Sudhir Mishra, Ruchi Narain, Ayush Raina, Revathy, Kundan Shah and starring Raj Singh Arora, Abhisar Bose, Neetu Chandra, Master Chinmay.",""
"Blue","Bollywood","Action Adventure Romance","2009","Anthony D'Souza","Akshay Kumar, Sanjay Dutt, Lara Dutta, Zayed Khan","5.3","A Bollywood Action Adventure Romance film released in 2009, directed by Anthony D'Souza and starring Akshay Kumar, Sanjay Dutt, Lara Dutta, Zayed Khan.",""
"Sirf....: Life Looks Greener on the Other Side","Bollywood","Drama","2008","Rajatesh Nayyar","Kay Kay Menon, Manisha Koirala, Ranvir Shorey, Sonali Kulkarni","4.4","A Bollywood Drama film released in 2008, directed by Rajatesh Nayyar and starring Kay Kay Menon, Manisha Koirala, Ranvir Shorey, Sonali Kulkarni.",""
"Aashayein","Bollywood","Comedy Drama","2010","Nagesh Kukunoor","John Abraham, Anaitha Nair, Girish Karnad, Farida Jalal","4.4","A Bollywood Comedy Drama film released in 2010, directed by Nagesh Kukunoor and starring John Abraham, Anaitha Nair, Girish Karnad, Farida Jalal.",""
"Aladin","Bollywood","Action Adventure Comedy","2009","Sujoy Ghosh","Shubhankar Atre, Amitabh Bachchan, Victor Banerjee, Dhaval Barbhaya","4.4","A Bollywood Action Adventure Comedy film released in 2009, directed by Sujoy Ghosh and starring Shubhankar Atre, Amitabh Bachchan, Victor Banerjee, Dhaval Barbhaya.",""
"Jimmy","Bollywood","Action Crime Drama","2008","Raj N. Sippy","Mimoh Chakraborty, Rati Agnihotri, Vikas Anand, Rahul Dev","4.4","A Bollywood Action Crime Drama film released in 2008, directed by Raj N. Sippy and starring Mimoh Chakraborty, Rati Agnihotri, Vikas Anand, Rahul Dev.",""
"Mr. White Mr. Black","Bollywood","Action Comedy Crime","2008","Deepak S. Shivdasani","Sunil Shetty, Arshad Warsi, Sadashiv Amrapurkar, Deep Dhillon","4.4","A Bollywood Action Comedy Crime film released in 2008, directed by Deepak S. Shivdasani and starring Sunil Shetty, Arshad Warsi, Sadashiv Amrapurkar, Deep Dhillon.",""
"Pranali: The Tradition","Bollywood","Crime Drama","2008","Hridesh Kamble","Nargis Bagheri, Upendra Limaye, Sudha Chandran, Raman Trikha","4.4","A Bollywood Crime Drama film released in 2008, directed by Hridesh Kamble and starring Nargis Bagheri, Upendra Limaye, Sudha Chandran, Raman Trikha.",""
"Rock On!!","Bollywood","Drama Music","2008","Abhishek Kapoor","Arjun Rampal, Farhan Akhtar, Luke Kenny, Purab Kohli","7.1","A Bollywood Drama Music film released in 2008, directed by Abhishek Kapoor and starring Arjun Rampal, Farhan Akhtar, Luke Kenny, Purab Kohli.",""
"Billu","Bollywood","Comedy Drama","2009","Priyadarshan","Irrfan Khan, Shah Rukh Khan, Lara Dutta, Om Puri","5.3","A Bollywood Comedy Drama film released in 2009, directed by Priyadarshan and starring Irrfan Khan, Shah Rukh Khan, Lara Dutta, Om Puri.",""
"Mehbooba","Bollywood","Drama Romance","2008","Tabrez Hashmi, Afzal Khan","Sanjay Dutt, Manisha Koirala, Ajay Devgn, Asrani","4.4","A Bollywood Drama Romance film released in 2008, directed by Tabrez Hashmi, Afzal Khan and starring Sanjay Dutt, Manisha Koirala, Ajay Devgn, Asrani.",""
"Phir Kabhi","Bollywood","Drama Romance","2008","V.K. Prakash","Mithun Chakraborty, Dimple Kapadia, Rati Agnihotri, Gulshan Grover","4.4","A Bollywood Drama Romance film released in 2008, directed by V.K. Prakash and starring Mithun Chakraborty, Dimple Kapadia, Rati Agnihotri, Gulshan Grover.",""
"Alibaba Aur 40 Chor","Bollywood","Action Adventure Drama","2004","Sunil Agnihotri","Azghar, Brownie, Divya Divedi, Anwar Fatehan","4.4","A Bollywood Action Adventure Drama film released in 2004, directed by Sunil Agnihotri and starring Azghar, Brownie, Divya Divedi, Anwar Fatehan.",""
"Dhoom Dadakka","Bollywood","Comedy Crime Drama","2008","Shashi Ranjan","Jackie Shroff, Anupam Kher, Satish Shah, Gulshan Grover","4.4","A Bollywood Comedy Crime Drama film released in 2008, directed by Shashi Ranjan and starring Jackie Shroff, Anupam Kher, Satish Shah, Gulshan Grover.",""
"Aamir","Bollywood","Drama Thriller","2008","Raj Kumar Gupta","Rajeev Khandelwal, Aishwarya, Vasan Bala, Chinkal","5.3","A Bollywood Drama Thriller film released in 2008, directed by Raj Kumar Gupta and starring Rajeev Khandelwal, Aishwarya, Vasan Bala, Chinkal.",""
"Saas Bahu Aur Sensex","Bollywood","Comedy Drama","2008","Shona Urvashi","Kiron Kher, Farooq Shaikh, Ankur Khanna, Masumeh Makhija","4.4","A Bollywood Comedy Drama film released in 2008, directed by Shona Urvashi and starring Kiron Kher, Farooq Shaikh, Ankur Khanna, Masumeh Makhija.",""
"What's Your Raashee?","Bollywood","Comedy Drama Romance","2009","Ashutosh Gowariker","Harman Baweja, Priyanka Chopra, Anjan Srivastav, Manju Singh","4.4","A Bollywood Comedy Drama Romance film released in 2009, directed by Ashutosh Gowariker and starring Harman Baweja, Priyanka Chopra, Anjan Srivastav, Manju Singh.",""
"Luck","Bollywood","Action Adventure Drama","2009","Soham Shah","Mithun Chakraborty, Sanjay Dutt, Imran Khan, Ravi Kishan","5.3","A Bollywood Action Adventure Drama film released in 2009, directed by Soham Shah and starring Mithun Chakraborty, Sanjay Dutt, Imran Khan, Ravi Kishan.",""
"Contract","Bollywood","Action Crime Drama","2008","Ram Gopal Varma","David Bueno, Vibha Cheebur, Raaj Gopal, Sakshi Gulati","5.3","A Bollywood Action Crime Drama film released in 2008, directed by Ram Gopal Varma and starring David Bueno, Vibha Cheebur, Raaj Gopal, Sakshi Gulati.",""
"Hisss","Bollywood","Comedy Drama Horror","2010","Jennifer Chambers Lynch","Mallika Sherawat, Irrfan Khan, Jeff Doucette, Divya Dutta","4.4","A Bollywood Comedy Drama Horror film released in 2010, directed by Jennifer Chambers Lynch and starring Mallika Sherawat, Irrfan Khan, Jeff Doucette, Divya Dutta.",""
"Jail","Bollywood","Drama","2009","Madhur Bhandarkar","Neil Nitin Mukesh, Manoj Bajpayee, Arya Babbar, Mirza Ali Quli","5.3","A Bollywood Drama film released in 2009, directed by Madhur Bhandarkar and starring Neil Nitin Mukesh, Manoj Bajpayee, Arya Babbar, Mirza Ali Quli.",""
"Haal-e-Dil","Bollywood","Drama Romance","2008","Anil Devgan","Amita Pathak, Nakuul Mehta, Adhyayan Suman, Nassar Abdulla","4.4","A Bollywood Drama Romance film released in 2008, directed by Anil Devgan and starring Amita Pathak, Nakuul Mehta, Adhyayan Suman, Nassar Abdulla.",""
"Khushboo: The Fragraance of Love","Bollywood","Comedy Drama Romance","2008","Rajesh Ram Singh","Rishi Rehan, Avantika, Thomas Tevana, Nassar Abdulla","4.4","A Bollywood Comedy Drama Romance film released in 2008, directed by Rajesh Ram Singh and starring Rishi Rehan, Avantika, Thomas Tevana, Nassar Abdulla.",""
"Aasma: The Sky Is the Limit","Bollywood","Drama","2009","Rohit Nayyar","Hrishitaa Bhatt, Seema Biswas, Nauheed Cyrusi, Mansi Dovhal","4.4","A Bollywood Drama film released in 2009, directed by Rohit Nayyar and starring Hrishitaa Bhatt, Seema Biswas, Nauheed Cyrusi, Mansi Dovhal.",""
"Ajab Prem Ki Ghazab Kahani","Bollywood","Comedy Romance","2009","Rajkumar Santoshi","Katrina Kaif, Ranbir Kapoor, Darshan Jariwala, Smita Jaykar","9.8","A Bollywood Comedy Romance film released in 2009, directed by Rajkumar Santoshi and starring Katrina Kaif, Ranbir Kapoor, Darshan Jariwala, Smita Jaykar.",""
"Sankat City","Bollywood","Comedy Crime Drama","2009","Pankaj Advani","Kay Kay Menon, Rimi Sen, Anupam Kher, Chunky Pandey","4.4","A Bollywood Comedy Crime Drama film released in 2009, directed by Pankaj Advani and starring Kay Kay Menon, Rimi Sen, Anupam Kher, Chunky Pandey.",""
"Hari Puttar: A Comedy of Terrors","Bollywood","Comedy Drama Family","2008","Rajesh Bajaj, Lucky Kohli","Jackie Shroff, Sarika, Saurabh Shukla, Vijay Raaz","4.4","A Bollywood Comedy Drama Family film released in 2008, directed by Rajesh Bajaj, Lucky Kohli and starring Jackie Shroff, Sarika, Saurabh Shukla, Vijay Raaz.",""
"De Dana Dan","Bollywood","Comedy","2009","Priyadarshan","Akshay Kumar, Sunil Shetty, Katrina Kaif, Sameera Reddy","7.1","A Bollywood Comedy film released in 2009, directed by Priyadarshan and starring Akshay Kumar, Sunil Shetty, Katrina Kaif, Sameera Reddy.",""
"Boond","Bollywood","Action Crime Drama","2001","Inayat Mahshar","Navin Berry, Pankaj Berry, Birbal, Sudhir Dalvi","4.4","A Bollywood Action Crime Drama film released in 2001, directed by Inayat Mahshar and starring Navin Berry, Pankaj Berry, Birbal, Sudhir Dalvi.",""
"Summer 2007","Bollywood","Crime Drama Thriller","2008","Sohail Tatari","Ahraz Ahmed, Punit Aneja, Arjan Bajwa, Neetu Chandra","4.4","A Bollywood Crime Drama Thriller film released in 2008, directed by Sohail Tatari and starring Ahraz Ahmed, Punit Aneja, Arjan Bajwa, Neetu Chandra.",""
"Gulaal","Bollywood","Crime Drama Mystery","2009","Anurag Kashyap","Kay Kay Menon, Raj Singh Chaudhary, Jesse Randhawa, Deepak Dobriyal","5.3","A Bollywood Crime Drama Mystery film released in 2009, directed by Anurag Kashyap and starring Kay Kay Menon, Raj Singh Chaudhary, Jesse Randhawa, Deepak Dobriyal.",""
"Mirchi: It's Hot","Bollywood","Crime","2004","Dinesh D. Awasthi","Bobby Khan, Nilofer Khan, Sambhavna Sheth, Nirmal Pandey","4.4","A Bollywood Crime film released in 2004, directed by Dinesh D. Awasthi and starring Bobby Khan, Nilofer Khan, Sambhavna Sheth, Nirmal Pandey.",""
"Chamku","Bollywood","Action Crime Drama","2008","Kabeer Kaushik","Bobby Deol, Priyanka Chopra, Irrfan Khan, Akhilendra Mishra","4.4","A Bollywood Action Crime Drama film released in 2008, directed by Kabeer Kaushik and starring Bobby Deol, Priyanka Chopra, Irrfan Khan, Akhilendra Mishra.",""
"Mumbai Meri Jaan","Bollywood","Drama","2008","Nishikant Kamat","Paresh Rawal, Kay Kay Menon, Irrfan Khan, Madhavan","5.3","A Bollywood Drama film released in 2008, directed by Nishikant Kamat and starring Paresh Rawal, Kay Kay Menon, Irrfan Khan, Madhavan.",""
"Thodi Life Thoda Magic","Bollywood","Drama","2008","Aanand Rai","Saahil Chadha, Arbaaz Khan, Anita Raj, Jackie Shroff","4.4","A Bollywood Drama film released in 2008, directed by Aanand Rai and starring Saahil Chadha, Arbaaz Khan, Anita Raj, Jackie Shroff.",""
"Phoonk","Bollywood","Drama Horror Mystery","2008","Ram Gopal Varma","Sudeep, Amruta Khanvilkar, Ahsaas Channa, Ashwini Khalsekar","8.9","A Bollywood Drama Horror Mystery film released in 2008, directed by Ram Gopal Varma and starring Sudeep, Amruta Khanvilkar, Ahsaas Channa, Ashwini Khalsekar.",""
"Kaminey: The Scoundrels","Bollywood","Action Comedy Crime","2009","Vishal Bhardwaj","Shahid Kapoor, Priyanka Chopra, Deb Mukherjee, Shivkumar Subramaniam","7.1","A Bollywood Action Comedy Crime film released in 2009, directed by Vishal Bhardwaj and starring Shahid Kapoor, Priyanka Chopra, Deb Mukherjee, Shivkumar Subramaniam.",""
"Love Aaj Kal","Bollywood","Comedy Drama Romance","2009","Imtiaz Ali","Saif Ali Khan, Deepika Padukone, Rishi Kapoor, Rahul Khanna","4.4","A Bollywood Comedy Drama Romance film released in 2009, directed by Imtiaz Ali and starring Saif Ali Khan, Deepika Padukone, Rishi Kapoor, Rahul Khanna.",""
"Sikandar","Bollywood","Crime Drama Mystery","2009","Piyush Jha","Parzan Dastur, Ayesha Kapoor, Sanjay Suri, Madhavan","4.4","A Bollywood Crime Drama Mystery film released in 2009, directed by Piyush Jha and starring Parzan Dastur, Ayesha Kapoor, Sanjay Suri, Madhavan.",""
"Ramaa: The Saviour","Bollywood","Animation Action Adventure","2010","Hadi Abrar","Sahil Khan, Tanushree Dutta, Meghan Jadhav, Koushtuv Ghosh","4.4","A Bollywood Animation Action Adventure film released in 2010, directed by Hadi Abrar and starring Sahil Khan, Tanushree Dutta, Meghan Jadhav, Koushtuv Ghosh.",""
"A Wednesday","Bollywood","Drama Thriller","2008","Neeraj Pandey","Anupam Kher, Naseeruddin Shah, Jimmy Shergill, Deepal Shaw","8.9","A Bollywood Drama Thriller film released in 2008, directed by Neeraj Pandey and starring Anupam Kher, Naseeruddin Shah, Jimmy Shergill, Deepal Shaw.",""
"My Friend Ganesha 2","Bollywood","Animation Family","2008","Rajiv S. Ruia","Harsh Chhaya, Kurush Deboo, Bhairavi Goswami, Ali Haji","4.4","A Bollywood Animation Family film released in 2008, directed by Rajiv S. Ruia and starring Harsh Chhaya, Kurush Deboo, Bhairavi Goswami, Ali Haji.",""
"Don 2","Bollywood","Action Crime Drama","2011","Farhan Akhtar","Shah Rukh Khan, Priyanka Chopra, Hrithik Roshan, Om Puri","8.9","A Bollywood Action Crime Drama film released in 2011, directed by Farhan Akhtar and starring Shah Rukh Khan, Priyanka Chopra, Hrithik Roshan, Om Puri.",""
"Lahore","Bollywood","Action Drama Sport","2010","Sanjay Puransingh Chauhan","Farooq Shaikh, Nafisa Ali, Aanaahad, Sabyasachi Chakraborty","4.4","A Bollywood Action Drama Sport film released in 2010, directed by Sanjay Puransingh Chauhan and starring Farooq Shaikh, Nafisa Ali, Aanaahad, Sabyasachi Chakraborty.",""
"Mukhbiir","Bollywood","Crime Drama Mystery","2008","Mani Shankar","Sammir Dattani, Rahul Dev, Om Puri, Alok Nath","4.4","A Bollywood Crime Drama Mystery film released in 2008, directed by Mani Shankar and starring Sammir Dattani, Rahul Dev, Om Puri, Alok Nath.",""
"Dasvidaniya","Bollywood","Comedy Drama","2008","Shashant Shah","Vinay Pathak, Sarita Joshi, Rajat Kapoor, Saurabh Shukla","4.4","A Bollywood Comedy Drama film released in 2008, directed by Shashant Shah and starring Vinay Pathak, Sarita Joshi, Rajat Kapoor, Saurabh Shukla.",""
"Mere Khwabon Mein Jo Aaye","Bollywood","Drama Fantasy Musical","2009","Madhureeta Anand","Randeep Hooda, Raima Sen, Arbaaz Khan, Javed Akhtar","4.4","A Bollywood Drama Fantasy Musical film released in 2009, directed by Madhureeta Anand and starring Randeep Hooda, Raima Sen, Arbaaz Khan, Javed Akhtar.",""
"Raajneeti","Bollywood","Action Crime Drama","2010","Prakash Jha","Naseeruddin Shah, Arjun Rampal, Nana Patekar, Ranbir Kapoor","9.8","A Bollywood Action Crime Drama film released in 2010, directed by Prakash Jha and starring Naseeruddin Shah, Arjun Rampal, Nana Patekar, Ranbir Kapoor.",""
"Allah Ke Banday","Bollywood","Action Crime Drama","2010","Faruk Kabir","Varun Bhagwat, Vikram Gokhale, Zakir Hussain, Bharat Jha","4.4","A Bollywood Action Crime Drama film released in 2010, directed by Faruk Kabir and starring Varun Bhagwat, Vikram Gokhale, Zakir Hussain, Bharat Jha.",""
"Oye Lucky! Lucky Oye!","Bollywood","Comedy Crime Drama","2008","Dibakar Banerjee","Abhay Deol, Paresh Rawal, Neetu Chandra, Archana Puran Singh","5.3","A Bollywood Comedy Crime Drama film released in 2008, directed by Dibakar Banerjee and starring Abhay Deol, Paresh Rawal, Neetu Chandra, Archana Puran Singh.",""
"1920","Bollywood","Drama Horror Mystery","2008","Vikram Bhatt","Rajneesh Duggal, Adah Sharma, Anjori Alagh, Rajendranath Zutshi","7.1","A Bollywood Drama Horror Mystery film released in 2008, directed by Vikram Bhatt and starring Rajneesh Duggal, Adah Sharma, Anjori Alagh, Rajendranath Zutshi.",""
"Aloo Chaat","Bollywood","Comedy Drama Romance","2009","Robby Grewal","Aftab Shivdasani, Aamna Shariff, Linda Arsenio, Sanjay Mishra","5.3","A Bollywood Comedy Drama Romance film released in 2009, directed by Robby Grewal and starring Aftab Shivdasani, Aamna Shariff, Linda Arsenio, Sanjay Mishra.",""
"Lamhaa: The Untold Story of Kashmir","Bollywood","Action Drama Thriller","2010","Rahul Dholakia","Alisha, Asif Basra, Bipasha Basu, Burhan","4.4","A Bollywood Action Drama Thriller film released in 2010, directed by Rahul Dholakia and starring Alisha, Asif Basra, Bipasha Basu, Burhan.",""
"Hulla","Bollywood","Comedy Drama","2008","Jaideep Varma","Sushant Singh, Kartika Rane, Rajat Kapoor, Mandeep Mazumdar","4.4","A Bollywood Comedy Drama film released in 2008, directed by Jaideep Varma and starring Sushant Singh, Kartika Rane, Rajat Kapoor, Mandeep Mazumdar.",""
"Ru-Ba-Ru","Bollywood","Drama Romance Thriller","2008","Arjun Bali","Rati Agnihotri, Shahana Goswami, Randeep Hooda, Kulbhushan Kharbanda","4.4","A Bollywood Drama Romance Thriller film released in 2008, directed by Arjun Bali and starring Rati Agnihotri, Shahana Goswami, Randeep Hooda, Kulbhushan Kharbanda.",""
"Rafoo Chakkar: Fun on the Run","Bollywood","Comedy Crime Drama","2008","B.H. Tharun Kumar","Sadashiv Amrapurkar, Tinnu Anand, Nauheed Cyrusi, Shakti Kapoor","4.4","A Bollywood Comedy Crime Drama film released in 2008, directed by B.H. Tharun Kumar and starring Sadashiv Amrapurkar, Tinnu Anand, Nauheed Cyrusi, Shakti Kapoor.",""
"Wake Up Sid","Bollywood","Comedy Drama Romance","2009","Ayan Mukherjee","Ranbir Kapoor, Konkona Sen Sharma, Supriya Pathak, Anupam Kher","8","A Bollywood Comedy Drama Romance film released in 2009, directed by Ayan Mukherjee and starring Ranbir Kapoor, Konkona Sen Sharma, Supriya Pathak, Anupam Kher.",""
"Fox","Bollywood","Crime Drama Mystery","2009","Deepak Tijori","Arjun Rampal, Sunny Deol, Udita Goswami, Sagarika Ghatge","4.4","A Bollywood Crime Drama Mystery film released in 2009, directed by Deepak Tijori and starring Arjun Rampal, Sunny Deol, Udita Goswami, Sagarika Ghatge.",""
"Kal Kissne Dekha","Bollywood","Action Crime Romance","2009","Vivek Sharma","Brahim Achabbakhe, Jacky Bhagnani, Nushrat Bharucha, David Bueno","4.4","A Bollywood Action Crime Romance film released in 2009, directed by Vivek Sharma and starring Brahim Achabbakhe, Jacky Bhagnani, Nushrat Bharucha, David Bueno.",""
"Dev D","Bollywood","Comedy Drama Romance","2009","Anurag Kashyap","Abhay Deol, Mahie Gill, Kalki Koechlin, Dibyendu Bhattacharya","7.1","A Bollywood Comedy Drama Romance film released in 2009, directed by Anurag Kashyap and starring Abhay Deol, Mahie Gill, Kalki Koechlin, Dibyendu Bhattacharya.",""
