"title","industry","genre","year","director","cast","rating","description","poster_url"
"Bachke Rehna Re Baba","Bollywood","Comedy","2005","Govind Menon","Rekha, Mallika Sherawat, Paresh Rawal, Satish Shah","5.3","A Bollywood Comedy film released in 2005, directed by Govind Menon and starring Rekha, Mallika Sherawat, Paresh Rawal, Satish Shah.",""
"Kyon Ki...","Bollywood","Drama Romance","2005","Priyadarshan","Salman Khan, Kareena Kapoor, Rimi Sen, Jackie Shroff","5.3","A Bollywood Drama Romance film released in 2005, directed by Priyadarshan and starring Salman Khan, Kareena Kapoor, Rimi Sen, Jackie Shroff.",""
"Maine Pyaar Kyun Kiya","Bollywood","Comedy Drama Romance","2005","David Dhawan","Salman Khan, Sushmita Sen, Katrina Kaif, Sohail Khan","8","A Bollywood Comedy Drama Romance film released in 2005, directed by David Dhawan and starring Salman Khan, Sushmita Sen, Katrina Kaif, Sohail Khan.",""
"My Wife's Murder","Bollywood","Thriller","2005","Jijy Philip","Anil Kapoor, Suchitra Krishnamoorthi, Nandana Sen, Rajesh Tandon","5.3","A Bollywood Thriller film released in 2005, directed by Jijy Philip and starring Anil Kapoor, Suchitra Krishnamoorthi, Nandana Sen, Rajesh Tandon.",""
"No Entry","Bollywood","Comedy Drama Musical","2005","Anees Bazmee","Anil Kapoor, Salman Khan, Fardeen Khan, Bipasha Basu","9.8","A Bollywood Comedy Drama Musical film released in 2005, directed by Anees Bazmee and starring Anil Kapoor, Salman Khan, Fardeen Khan, Bipasha Basu.",""
"Paheli","Bollywood","Fantasy Romance","2005","Amol Palekar","Shah Rukh Khan, Anupam Kher, Rani Mukerji, Amitabh Bachchan","6.2","A Bollywood Fantasy Romance film released in 2005, directed by Amol Palekar and starring Shah Rukh Khan, Anupam Kher, Rani Mukerji, Amitabh Bachchan.",""
"Socha Na Tha","Bollywood","Romance Comedy","2005","Imtiaz Ali","Abhay Deol, Ayesha Takia, Ayesha Jhulka, Apoorva Jha","5.3","A Bollywood Romance Comedy film released in 2005, directed by Imtiaz Ali and starring Abhay Deol, Ayesha Takia, Ayesha Jhulka, Apoorva Jha.",""
"Zeher","Bollywood","Thriller","2005","Mohit Suri","Emraan Hashmi, Shamita Shetty, Udita Goswami, Sameer Kochhar","7.1","A Bollywood Thriller film released in 2005, directed by Mohit Suri and starring Emraan Hashmi, Shamita Shetty, Udita Goswami, Sameer Kochhar.",""
"7 1/2 Phere: More Than a Wedding","Bollywood","Comedy Drama","2005","Ishaan Trivedi","Juhi Chawla, Irrfan Khan, Manoj Pahwa, Nina Kulkarni","4.4","A Bollywood Comedy Drama film released in 2005, directed by Ishaan Trivedi and starring Juhi Chawla, Irrfan Khan, Manoj Pahwa, Nina Kulkarni.",""
"Garam Masala","Bollywood","Comedy","2005","Priyadarshan","Akshay Kumar, John Abraham, Paresh Rawal, Rimi Sen","8.9","A Bollywood Comedy film released in 2005, directed by Priyadarshan and starring Akshay Kumar, John Abraham, Paresh Rawal, Rimi Sen.",""
"Iqbal","Bollywood","Drama","2005","Nagesh Kukunoor","Naseeruddin Shah, Girish Karnad, Shreyas Talpade, Shweta Prasad","7.1","A Bollywood Drama film released in 2005, directed by Nagesh Kukunoor and starring Naseeruddin Shah, Girish Karnad, Shreyas Talpade, Shweta Prasad.",""
"Kuchh Meetha Ho Jaye","Bollywood","Comedy Romance","2005","Samar Khan","Arshad Warsi, Mahima Chaudhry, Parvin Dabas, Sandhya Mridul","4.4","A Bollywood Comedy Romance film released in 2005, directed by Samar Khan and starring Arshad Warsi, Mahima Chaudhry, Parvin Dabas, Sandhya Mridul.",""
"Aryan: Unbreakable","Bollywood","Drama","2006","Abhishek Kapoor","Sohail Khan, Sneha Ullal, Inder Kumar, Farida Jalal","4.4","A Bollywood Drama film released in 2006, directed by Abhishek Kapoor and starring Sohail Khan, Sneha Ullal, Inder Kumar, Farida Jalal.",""
"Chingaari","Bollywood","Drama","2006","Kalpana Lajmi","Sushmita Sen, Mithun Chakraborty, Anuj Sawhney, Ila Arun","4.4","A Bollywood Drama film released in 2006, directed by Kalpana Lajmi and starring Sushmita Sen, Mithun Chakraborty, Anuj Sawhney, Ila Arun.",""
"Lage Raho Munna Bhai","Bollywood","Comedy Drama Romance","2006","Rajkumar Hirani","Sanjay Dutt, Arshad Warsi, Vidya Balan, Boman Irani","10.7","A Bollywood Comedy Drama Romance film released in 2006, directed by Rajkumar Hirani and starring Sanjay Dutt, Arshad Warsi, Vidya Balan, Boman Irani.",""
"Salaam Namaste","Bollywood","Comedy Drama Romance","2005","Siddharth Anand","Saif Ali Khan, Preity Zinta, Arshad Warsi, Tania Zaetta","8.9","A Bollywood Comedy Drama Romance film released in 2005, directed by Siddharth Anand and starring Saif Ali Khan, Preity Zinta, Arshad Warsi, Tania Zaetta.",""
"Fight Club: Members Only","Bollywood","Action Comedy","2006","Vikram Chopra","Sunil Shetty, Sohail Khan, Zayed Khan, Dino Morea","5.3","A Bollywood Action Comedy film released in 2006, directed by Vikram Chopra and starring Sunil Shetty, Sohail Khan, Zayed Khan, Dino Morea.",""
"Jaan-E-Mann: Let's Fall in Love... Again","Bollywood","Musical Romance","2006","Shirish Kunder","Salman Khan, Akshay Kumar, Preity Zinta, Anupam Kher","5.3","A Bollywood Musical Romance film released in 2006, directed by Shirish Kunder and starring Salman Khan, Akshay Kumar, Preity Zinta, Anupam Kher.",""
"Kyaa Kool Hai Hum","Bollywood","Comedy Mystery","2005","Sangeeth Sivan","Tusshar Kapoor, Ritesh Deshmukh, Isha Koppikar, Neha Dhupia","8.9","A Bollywood Comedy Mystery film released in 2005, directed by Sangeeth Sivan and starring Tusshar Kapoor, Ritesh Deshmukh, Isha Koppikar, Neha Dhupia.",""
"Mr Ya Miss","Bollywood","Comedy","2005","Antara Mali, Satchit Puranik","Antara Mali, Ritesh Deshmukh, Divya Dutta, Aftab Shivdasani","5.3","A Bollywood Comedy film released in 2005, directed by Antara Mali, Satchit Puranik and starring Antara Mali, Ritesh Deshmukh, Divya Dutta, Aftab Shivdasani.",""
"Nazar","Bollywood","Thriller","2005","Soni Razdan","Meera, Ashmit Patel, Koel Purie, Neena Gupta","5.3","A Bollywood Thriller film released in 2005, directed by Soni Razdan and starring Meera, Ashmit Patel, Koel Purie, Neena Gupta.",""
"Ek Ajnabee","Bollywood","Action Adventure Crime","2005","Apoorva Lakhia","Amitabh Bachchan, Arjun Rampal, Perizaad Zorabian, Rucha Vaidya","5.3","A Bollywood Action Adventure Crime film released in 2005, directed by Apoorva Lakhia and starring Amitabh Bachchan, Arjun Rampal, Perizaad Zorabian, Rucha Vaidya.",""
"Home Delivery: Aapko... Ghar Tak","Bollywood","Comedy Romance","2005","Sujoy Ghosh","Vivek Oberoi, Mahima Chaudhry, Ayesha Takia, Boman Irani","4.4","A Bollywood Comedy Romance film released in 2005, directed by Sujoy Ghosh and starring Vivek Oberoi, Mahima Chaudhry, Ayesha Takia, Boman Irani.",""
"Mixed Doubles","Bollywood","Comedy Drama","2006","Rajat Kapoor","Konkona Sen Sharma, Ranvir Shorey, Koel Purie, Saurabh Shukla","5.3","A Bollywood Comedy Drama film released in 2006, directed by Rajat Kapoor and starring Konkona Sen Sharma, Ranvir Shorey, Koel Purie, Saurabh Shukla.",""
"Mumbai Godfather","Bollywood","Action Crime Drama","2005","Deepak Balraj Vij","Seema Biswas, Vikram Singh, Bhumika, Govind Namdeo","4.4","A Bollywood Action Crime Drama film released in 2005, directed by Deepak Balraj Vij and starring Seema Biswas, Vikram Singh, Bhumika, Govind Namdeo.",""
"Shabnam Mausi","Bollywood","Drama","2005","Yogesh Bharadwaj","Ashutosh Rana, Sujeet Chaubey, Divya Desai, Jasvvant Khera","4.4","A Bollywood Drama film released in 2005, directed by Yogesh Bharadwaj and starring Ashutosh Rana, Sujeet Chaubey, Divya Desai, Jasvvant Khera.",""
"Gandhi, My Father","Bollywood","Biography Drama History","2007","Feroz Abbas Khan","Akshaye Khanna, Darshan Jariwala, Shefali Shetty, Bhoomika Chawla","4.4","A Bollywood Biography Drama History film released in 2007, directed by Feroz Abbas Khan and starring Akshaye Khanna, Darshan Jariwala, Shefali Shetty, Bhoomika Chawla.",""
"Kahaani Gudiya Ki...: True Story of a Woman","Bollywood","Drama","2008","Prabhakar Shukla","Divya Dutta, Arif Zakaria, Rajpal Yadav, Somed Agarwal","4.4","A Bollywood Drama film released in 2008, directed by Prabhakar Shukla and starring Divya Dutta, Arif Zakaria, Rajpal Yadav, Somed Agarwal.",""
"Naam Gum Jaayega","Bollywood","Thriller","2005","Amol Shetge","Raqesh Vashisth, Dia Mirza, Aryan Vaid, Mandira Bedi","4.4","A Bollywood Thriller film released in 2005, directed by Amol Shetge and starring Raqesh Vashisth, Dia Mirza, Aryan Vaid, Mandira Bedi.",""
"Eklavya: The Royal Guard","Bollywood","Action Drama Thriller","2007","Vidhu Vinod Chopra","Amitabh Bachchan, Saif Ali Khan, Sanjay Dutt, Vidya Balan","5.3","A Bollywood Action Drama Thriller film released in 2007, directed by Vidhu Vinod Chopra and starring Amitabh Bachchan, Saif Ali Khan, Sanjay Dutt, Vidya Balan.",""
"Ek Khiladi Ek Haseena","Bollywood","Comedy Crime Thriller","2005","Suparn Verma","Fardeen Khan, Koena Mitra, Kay Kay Menon, Rakhi Sawant","5.3","A Bollywood Comedy Crime Thriller film released in 2005, directed by Suparn Verma and starring Fardeen Khan, Koena Mitra, Kay Kay Menon, Rakhi Sawant.",""
"Kal: Yesterday and Tomorrow","Bollywood","Drama Mystery Thriller","2005","Ruchi Narain","Shiney Ahuja, Murad Ali, Ahmed Chaudhary, Gopi Desai","4.4","A Bollywood Drama Mystery Thriller film released in 2005, directed by Ruchi Narain and starring Shiney Ahuja, Murad Ali, Ahmed Chaudhary, Gopi Desai.",""
"Pyare Mohan","Bollywood","Comedy Drama Romance","2006","Indra Kumar, Kookie V. Gulati","Fardeen Khan, Vivek Oberoi, Esha Deol, Amrita Rao","5.3","A Bollywood Comedy Drama Romance film released in 2006, directed by Indra Kumar, Kookie V. Gulati and starring Fardeen Khan, Vivek Oberoi, Esha Deol, Amrita Rao.",""
"Don","Bollywood","Action Crime Thriller","2006","Farhan Akhtar","Shah Rukh Khan, Priyanka Chopra, Arjun Rampal, Isha Koppikar","8.9","A Bollywood Action Crime Thriller film released in 2006, directed by Farhan Akhtar and starring Shah Rukh Khan, Priyanka Chopra, Arjun Rampal, Isha Koppikar.",""
"2 October","Bollywood","Crime","2003","Sunil Tiwari","Ashutosh Rana, Saadhika, Sharat Saxena, Rocky Verma","4.4","A Bollywood Crime film released in 2003, directed by Sunil Tiwari and starring Ashutosh Rana, Saadhika, Sharat Saxena, Rocky Verma.",""
"Chup Chup Ke","Bollywood","Comedy Drama Romance","2006","Priyadarshan, Kookie V. Gulati","Kareena Kapoor, Shahid Kapoor, Paresh Rawal, Neha Dhupia","7.1","A Bollywood Comedy Drama Romance film released in 2006, directed by Priyadarshan, Kookie V. Gulati and starring Kareena Kapoor, Shahid Kapoor, Paresh Rawal, Neha Dhupia.",""
"Bhairav","Bollywood","Action","2001","T.L.V. Prasad","Hemant Birje, Mithun Chakraborty, Jack Gaud, Brij Gopal","4.4","A Bollywood Action film released in 2001, directed by T.L.V. Prasad and starring Hemant Birje, Mithun Chakraborty, Jack Gaud, Brij Gopal.",""
"Chand Sa Roshan Chehra","Bollywood","Romance","2005","Shabah Shamsi","Samir Aftab, Talat Aziz, Tamannaah Bhatia, Kurush Deboo","4.4","A Bollywood Romance film released in 2005, directed by Shabah Shamsi and starring Samir Aftab, Talat Aziz, Tamannaah Bhatia, Kurush Deboo.",""
"Ssukh","Bollywood","Comedy Family Romance","2005","Kirti Kumar","Aarti Chhabria, Jackie Shroff, Mahesh Anand, Rana Jung Bahadur","4.4","A Bollywood Comedy Family Romance film released in 2005, directed by Kirti Kumar and starring Aarti Chhabria, Jackie Shroff, Mahesh Anand, Rana Jung Bahadur.",""
"Khosla's Nest","Bollywood","Comedy Crime Drama","2006","Dibakar Banerjee","Anupam Kher, Boman Irani, Parvin Dabas, Tara Sharma","7.1","A Bollywood Comedy Crime Drama film released in 2006, directed by Dibakar Banerjee and starring Anupam Kher, Boman Irani, Parvin Dabas, Tara Sharma.",""
"The Film","Bollywood","Drama Thriller","2005","Junaid Memon","Nassar Abdulla, Ravi Baswani, Rakesh Bedi, Mahima Chaudhry","4.4","A Bollywood Drama Thriller film released in 2005, directed by Junaid Memon and starring Nassar Abdulla, Ravi Baswani, Rakesh Bedi, Mahima Chaudhry.",""
"Siskiyaan","Bollywood","Drama Thriller","2005","Ashwini Chaudhary","Sanjay Chauhan, Neha Dhupia, Sachin Khedekar, Preeti Puri","4.4","A Bollywood Drama Thriller film released in 2005, directed by Ashwini Chaudhary and starring Sanjay Chauhan, Neha Dhupia, Sachin Khedekar, Preeti Puri.",""
"Kasak","Bollywood","Drama","2005","Rajiv Babbar","Lucky Ali, Meera, Mukesh Tiwari, Nandini","4.4","A Bollywood Drama film released in 2005, directed by Rajiv Babbar and starring Lucky Ali, Meera, Mukesh Tiwari, Nandini.",""
"Saawan... The Love Season","Bollywood","Romance","2006","Saawan Kumar Tak","Salman Khan, Saloni Aswani, Kapil Jhaveri, Prem Chopra","5.3","A Bollywood Romance film released in 2006, directed by Saawan Kumar Tak and starring Salman Khan, Saloni Aswani, Kapil Jhaveri, Prem Chopra.",""
"Yun Hota Toh Kya Hota: What If...?","Bollywood","Drama","2006","Naseeruddin Shah","Konkona Sen Sharma, Irrfan Khan, Ayesha Takia, Jimmy Shergill","4.4","A Bollywood Drama film released in 2006, directed by Naseeruddin Shah and starring Konkona Sen Sharma, Irrfan Khan, Ayesha Takia, Jimmy Shergill.",""
"Neal 'N' Nikki","Bollywood","Comedy Musical Romance","2005","Arjun Sablok","Uday Chopra, Tanisha, Abhishek Bachchan, Richa Pallod","5.3","A Bollywood Comedy Musical Romance film released in 2005, directed by Arjun Sablok and starring Uday Chopra, Tanisha, Abhishek Bachchan, Richa Pallod.",""
"Darwaza Bandh Rakho","Bollywood","Comedy Crime Drama","2006","J.D. Chakravarthi","Ishrat Ali, Abhay Bhargav, Snehal Dabi, Divya Dutta","4.4","A Bollywood Comedy Crime Drama film released in 2006, directed by J.D. Chakravarthi and starring Ishrat Ali, Abhay Bhargav, Snehal Dabi, Divya Dutta.",""
"Ram Gopal Varma's Indian Flames","Bollywood","Action Adventure Comedy","2007","Ram Gopal Varma","Amitabh Bachchan, Mohanlal, Ajay Devgn, Vinod Jaywant","4.4","A Bollywood Action Adventure Comedy film released in 2007, directed by Ram Gopal Varma and starring Amitabh Bachchan, Mohanlal, Ajay Devgn, Vinod Jaywant.",""
"Jaane Tu... Ya Jaane Na","Bollywood","Comedy Drama Romance","2008","Abbas Tyrewala","Imran Khan, Genelia D'Souza, Manjari Phadnis, Ayaz Khan","9.8","A Bollywood Comedy Drama Romance film released in 2008, directed by Abbas Tyrewala and starring Imran Khan, Genelia D'Souza, Manjari Phadnis, Ayaz Khan.",""
"...Yahaan","Bollywood","Romance","2005","Shoojit Sircar","Jimmy Shergill, Minissha Lamba, Yashpal Sharma, Mukesh Tiwari","4.4","A Bollywood Romance film released in 2005, directed by Shoojit Sircar and starring Jimmy Shergill, Minissha Lamba, Yashpal Sharma, Mukesh Tiwari.",""
"Shikhar","Bollywood","Drama Musical Romance","2005","John Mathew Matthan","Ajay Devgn, Shahid Kapoor, Bipasha Basu, Amrita Rao","5.3","A Bollywood Drama Musical Romance film released in 2005, directed by John Mathew Matthan and starring Ajay Devgn, Shahid Kapoor, Bipasha Basu, Amrita Rao.",""
"Vaah! Life Ho Toh Aisi!","Bollywood","Comedy Family Musical","2005","Mahesh Manjrekar","Shahid Kapoor, Amrita Rao, Sanjay Dutt, Arshad Warsi","5.3","A Bollywood Comedy Family Musical film released in 2005, directed by Mahesh Manjrekar and starring Shahid Kapoor, Amrita Rao, Sanjay Dutt, Arshad Warsi.",""
"Bluffmaster!","Bollywood","Comedy Romance Thriller","2005","Rohan Sippy","Abhishek Bachchan, Priyanka Chopra, Ritesh Deshmukh, Nana Patekar","8","A Bollywood Comedy Romance Thriller film released in 2005, directed by Rohan Sippy and starring Abhishek Bachchan, Priyanka Chopra, Ritesh Deshmukh, Nana Patekar.",""
"God Tussi Great Ho","Bollywood","Comedy Drama Romance","2008","Rumi Jaffery","Amitabh Bachchan, Salman Khan, Priyanka Chopra, Anupam Kher","5.3","A Bollywood Comedy Drama Romance film released in 2008, directed by Rumi Jaffery and starring Amitabh Bachchan, Salman Khan, Priyanka Chopra, Anupam Kher.",""
"Aksar","Bollywood","Drama Romance","2006","Anant Mahadevan","Rajat Bedi, Till Dilumi?re, Udita Goswami, Hendrik Greis","8","A Bollywood Drama Romance film released in 2006, directed by Anant Mahadevan and starring Rajat Bedi, Till Dilumi?re, Udita Goswami, Hendrik Greis.",""
"Big Brother","Bollywood","Action Crime","2007","Guddu Dhanoa","Sunny Deol, Priyanka Chopra, Vikas Anand, Manoj Bhatia","4.4","A Bollywood Action Crime film released in 2007, directed by Guddu Dhanoa and starring Sunny Deol, Priyanka Chopra, Vikas Anand, Manoj Bhatia.",""
"Malamaal Weekly","Bollywood","Comedy Drama Romance","2006","Priyadarshan","Paresh Rawal, Om Puri, Ritesh Deshmukh, Reema Sen","9.8","A Bollywood Comedy Drama Romance film released in 2006, directed by Priyadarshan and starring Paresh Rawal, Om Puri, Ritesh Deshmukh, Reema Sen.",""
"Nehlle Pe Dehlla","Bollywood","Comedy Thriller","2007","Ajay Chandhok","Saif Ali Khan, Bipasha Basu, Neha Dhupia, Sanjay Dutt","4.4","A Bollywood Comedy Thriller film released in 2007, directed by Ajay Chandhok and starring Saif Ali Khan, Bipasha Basu, Neha Dhupia, Sanjay Dutt.",""
"Ramji Londonwaley","Bollywood","Comedy Drama Family","2005","Sanjay Dayma","Madhavan, Samita Bangargi, Satish Shah, Akhilendra Mishra","4.4","A Bollywood Comedy Drama Family film released in 2005, directed by Sanjay Dayma and starring Madhavan, Samita Bangargi, Satish Shah, Akhilendra Mishra.",""
"Taxi No. 9 2 11: Nau Do Gyarah","Bollywood","Comedy Drama Thriller","2006","Milan Luthria","Nana Patekar, John Abraham, Sonali Kulkarni, Sameera Reddy","8","A Bollywood Comedy Drama Thriller film released in 2006, directed by Milan Luthria and starring Nana Patekar, John Abraham, Sonali Kulkarni, Sameera Reddy.",""
"Tom, Dick, and Harry","Bollywood","Comedy Romance","2006","Deepak Tijori","Rakesh Bedi, Bobby Darling, Avtar Gill, Gulshan Grover","7.1","A Bollywood Comedy Romance film released in 2006, directed by Deepak Tijori and starring Rakesh Bedi, Bobby Darling, Avtar Gill, Gulshan Grover.",""
"36 China Town","Bollywood","Comedy Mystery Thriller","2006","Abbas Alibhai Burmawalla, Mastan Alibhai Burmawalla","Akshaye Khanna, Kareena Kapoor, Shahid Kapoor, Paresh Rawal","8","A Bollywood Comedy Mystery Thriller film released in 2006, directed by Abbas Alibhai Burmawalla, Mastan Alibhai Burmawalla and starring Akshaye Khanna, Kareena Kapoor, Shahid Kapoor, Paresh Rawal.",""
"Aashiq Banaya Aapne: Love Takes Over","Bollywood","Drama Romance Thriller","2005","Aditya Datt","Tanushree Dutta, Preeti Ganguli, Emraan Hashmi, Ashwini Khalsekar","6.2","A Bollywood Drama Romance Thriller film released in 2005, directed by Aditya Datt and starring Tanushree Dutta, Preeti Ganguli, Emraan Hashmi, Ashwini Khalsekar.",""
"Bengal Tiger","Bollywood","Action Crime","2001","Adarsh Jain","Sandeep Bedi, Mithun Chakraborty, Roshini Jaffery, Raushani Jaffrey","4.4","A Bollywood Action Crime film released in 2001, directed by Adarsh Jain and starring Sandeep Bedi, Mithun Chakraborty, Roshini Jaffery, Raushani Jaffrey.",""
"Sehar","Bollywood","Action Crime Drama","2005","Kabeer Kaushik","Arshad Warsi, Pankaj Kapur, Mahima Chaudhry, Sushant Singh","5.3","A Bollywood Action Crime Drama film released in 2005, directed by Kabeer Kaushik and starring Arshad Warsi, Pankaj Kapur, Mahima Chaudhry, Sushant Singh.",""
"Koi Mere Dil Mein Hai","Bollywood","Drama","2005","Deepak Ramsay","Dia Mirza, Sadashiv Amrapurkar, Rita Bhaduri, Birbal","4.4","A Bollywood Drama film released in 2005, directed by Deepak Ramsay and starring Dia Mirza, Sadashiv Amrapurkar, Rita Bhaduri, Birbal.",""
"Gumnam Qatil","Bollywood","Horror","2001","Harinam Singh","Yunus Parvez, Mahesh Raj, Ghanshyam Rohera, Rakesh","4.4","A Bollywood Horror film released in 2001, directed by Harinam Singh and starring Yunus Parvez, Mahesh Raj, Ghanshyam Rohera, Rakesh.",""
"Pyaar Ke Side Effects","Bollywood","Comedy Drama Romance","2006","Saket Chaudhary","Rahul Bose, Mallika Sherawat, Ranvir Shorey, Sharat Saxena","6.2","A Bollywood Comedy Drama Romance film released in 2006, directed by Saket Chaudhary and starring Rahul Bose, Mallika Sherawat, Ranvir Shorey, Sharat Saxena.",""
"Ek Aur Visphot","Bollywood","Crime","2002","M.I. Raj","Makrand Deshpande, Kishori Godbole, Raza Murad, Mahavir Shah","4.4","A Bollywood Crime film released in 2002, directed by M.I. Raj and starring Makrand Deshpande, Kishori Godbole, Raza Murad, Mahavir Shah.",""
"Kyon?","Bollywood","Crime","2003","Kalpana Lajmi","Vinay Apte, Ashok Beniwal, Chaitanya Chaudhary, Rahul Dev","4.4","A Bollywood Crime film released in 2003, directed by Kalpana Lajmi and starring Vinay Apte, Ashok Beniwal, Chaitanya Chaudhary, Rahul Dev.",""
"Bullet: Ek Dhamaka","Bollywood","Action Drama","2005","Irfan Khan","Benjamin Gilani, Natalya Gudkova, Iqbal Khan, Asseem Merchant","4.4","A Bollywood Action Drama film released in 2005, directed by Irfan Khan and starring Benjamin Gilani, Natalya Gudkova, Iqbal Khan, Asseem Merchant.",""
"Marshal","Bollywood","Action","2002","Manish R. Khandelwal","Ishrat Ali, Liyaqat Bari, Mithun Chakraborty, Charulatha","4.4","A Bollywood Action film released in 2002, directed by Manish R. Khandelwal and starring Ishrat Ali, Liyaqat Bari, Mithun Chakraborty, Charulatha.",""
"Miss India: The Mystery","Bollywood","Mystery","2003","Pradeep Maini","Priyanka Chopra, Neha Dhupia, Dolly, Supriya Karnik","4.4","A Bollywood Mystery film released in 2003, directed by Pradeep Maini and starring Priyanka Chopra, Neha Dhupia, Dolly, Supriya Karnik.",""
"Salaam-E-Ishq","Bollywood","Comedy Drama Musical","2007","Nikhil Advani","Salman Khan, Priyanka Chopra, Anil Kapoor, Juhi Chawla","4.4","A Bollywood Comedy Drama Musical film released in 2007, directed by Nikhil Advani and starring Salman Khan, Priyanka Chopra, Anil Kapoor, Juhi Chawla.",""
"Jawani Diwani: A Youthful Joyride","Bollywood","Romance","2006","Manish Sharma","Emraan Hashmi, Celina Jaitly, Hrishitaa Bhatt, Mahesh Manjrekar","5.3","A Bollywood Romance film released in 2006, directed by Manish Sharma and starring Emraan Hashmi, Celina Jaitly, Hrishitaa Bhatt, Mahesh Manjrekar.",""
"Main, Meri Patni... Aur Woh!","Bollywood","Comedy Drama Romance","2005","Chandan Arora","Naseeruddin Shah, Rajpal Yadav, Rituparna Sengupta, Kay Kay Menon","4.4","A Bollywood Comedy Drama Romance film released in 2005, directed by Chandan Arora and starring Naseeruddin Shah, Rajpal Yadav, Rituparna Sengupta, Kay Kay Menon.",""
"Umrao Jaan","Bollywood","Drama Romance","2006","J.P. Dutta","Aishwarya Rai Bachchan, Shabana Azmi, Sunil Shetty, Abhishek Bachchan","4.4","A Bollywood Drama Romance film released in 2006, directed by J.P. Dutta and starring Aishwarya Rai Bachchan, Shabana Azmi, Sunil Shetty, Abhishek Bachchan.",""
"Time Pass","Bollywood","Romance","2005","Chander Mishra","Sherlyn Chopra, Tanaaz Currim Irani, Adi Irani, Monica Patel","4.4","A Bollywood Romance film released in 2005, directed by Chander Mishra and starring Sherlyn Chopra, Tanaaz Currim Irani, Adi Irani, Monica Patel.",""
"London Dreams","Bollywood","Musical","2009","Vipul Amrutlal Shah","Salman Khan, Om Puri, Ajay Devgn, Dilyana Bouklieva","5.3","A Bollywood Musical film released in 2009, directed by Vipul Amrutlal Shah and starring Salman Khan, Om Puri, Ajay Devgn, Dilyana Bouklieva.",""
"Chand Bujh Gaya","Bollywood","Drama Thriller","2005","Sharique Minhaj","Mukesh Ahuja, Ishrat Ali, Aliza, Neha Bam","4.4","A Bollywood Drama Thriller film released in 2005, directed by Sharique Minhaj and starring Mukesh Ahuja, Ishrat Ali, Aliza, Neha Bam.",""
"Chetna: The Excitement","Bollywood","Thriller","2005","N/A","Jatin Grewal, Navneet Kaur, Kiran Kumar, Payal Rohatgi","4.4","A Bollywood Thriller film released in 2005, directed by N/A and starring Jatin Grewal, Navneet Kaur, Kiran Kumar, Payal Rohatgi.",""
"Darwaza","Bollywood","Horror","2002","Kanti Shah","Arun Mathur, Anil Nagrath, Amit Pachori, Sapna","4.4","A Bollywood Horror film released in 2002, directed by Kanti Shah and starring Arun Mathur, Anil Nagrath, Amit Pachori, Sapna.",""
"Mazaa Mazaa","Bollywood","Romance","2005","T.L.V. Prasad","Farid Amiri, Mridula Baruah, Pankaj Berry, Camila Bordonaba","4.4","A Bollywood Romance film released in 2005, directed by T.L.V. Prasad and starring Farid Amiri, Mridula Baruah, Pankaj Berry, Camila Bordonaba.",""
"Corporate","Bollywood","Drama","2006","Madhur Bhandarkar","Bipasha Basu, Kay Kay Menon, Raj Babbar, Rajat Kapoor","7.1","A Bollywood Drama film released in 2006, directed by Madhur Bhandarkar and starring Bipasha Basu, Kay Kay Menon, Raj Babbar, Rajat Kapoor.",""
"Omkara","Bollywood","Action Crime Drama","2006","Vishal Bhardwaj","Ajay Devgn, Kareena Kapoor, Saif Ali Khan, Konkona Sen Sharma","5.3","A Bollywood Action Crime Drama film released in 2006, directed by Vishal Bhardwaj and starring Ajay Devgn, Kareena Kapoor, Saif Ali Khan, Konkona Sen Sharma.",""
"Welcome","Bollywood","Comedy Crime Drama","2007","Anees Bazmee","Akshay Kumar, Nana Patekar, Anil Kapoor, Mallika Sherawat","9.8","A Bollywood Comedy Crime Drama film released in 2007, directed by Anees Bazmee and starring Akshay Kumar, Nana Patekar, Anil Kapoor, Mallika Sherawat.",""
"Hanuman","Bollywood","Animation","2005","V.G. Samant, Milind Ukey","Archi, Rajesh Jolly, Mukesh Khanna, Sushmita Mukherjee","8","A Bollywood Animation film released in 2005, directed by V.G. Samant, Milind Ukey and starring Archi, Rajesh Jolly, Mukesh Khanna, Sushmita Mukherjee.",""
"Koi Aap Sa: But Lovers Have to Be Friends","Bollywood","Comedy Drama Romance","2005","Partho Mitra","Aftab Shivdasani, Anita Hassandani, Dipannita Sharma, Himanshu Malik","4.4","A Bollywood Comedy Drama Romance film released in 2005, directed by Partho Mitra and starring Aftab Shivdasani, Anita Hassandani, Dipannita Sharma, Himanshu Malik.",""
"Zinda","Bollywood","Action Adventure Drama","2006","Sanjay Gupta","Sanjay Dutt, John Abraham, Lara Dutta, Celina Jaitly","5.3","A Bollywood Action Adventure Drama film released in 2006, directed by Sanjay Gupta and starring Sanjay Dutt, John Abraham, Lara Dutta, Celina Jaitly.",""
